{"$defs":{"authority":{"additionalProperties":false,"properties":{"credential_export_allowed":{"const":false},"effect_authority":{"const":false},"execute_allowed":{"const":false},"external_effect":{"const":false},"external_network_allowed":{"const":false},"g5_allowed":{"const":false},"machine_authority":{"const":false},"operator_acceptance":{"const":false},"production_caller":{"const":false},"production_writer":{"const":false},"promotion":{"const":false},"release_qualified":{"const":false},"runtime_authority":{"const":false}},"required":["machine_authority","runtime_authority","production_caller","production_writer","effect_authority","external_effect","external_network_allowed","credential_export_allowed","operator_acceptance","g5_allowed","execute_allowed","promotion","release_qualified"],"type":"object"},"file_entry":{"additionalProperties":false,"properties":{"git_blob_sha1":{"$ref":"#/$defs/sha1"},"max_bytes":{"maximum":8388608,"minimum":1,"type":"integer"},"path":{"pattern":"^(?!/)(?!.*(?:^|/)\\.\\.(?:/|$))(?!.*\\\\)[^\\u0000]{1,1024}$","type":"string"},"required_anchors":{"items":{"maxLength":2048,"minLength":1,"type":"string"},"maxItems":64,"minItems":1,"type":"array","uniqueItems":true},"role":{"maxLength":1024,"minLength":1,"type":"string"}},"required":["path","git_blob_sha1","max_bytes","role","required_anchors"],"type":"object"},"sha1":{"pattern":"^[0-9a-f]{40}$","type":"string"},"sha256":{"pattern":"^[0-9a-f]{64}$","type":"string"}},"$id":"hepta.servo.worker_source_topology.v1","$schema":"https://json-schema.org/draft/2020-12/schema","additionalProperties":false,"properties":{"api_contract":{"additionalProperties":false,"properties":{"forbidden_public_surfaces":{"items":{"maxLength":256,"minLength":1,"type":"string"},"minItems":1,"type":"array","uniqueItems":true},"one_webview_collection_type":{"const":"Option<WebView>"},"required_public_methods":{"items":{"maxLength":256,"minLength":1,"type":"string"},"minItems":1,"type":"array","uniqueItems":true},"required_public_types":{"items":{"maxLength":256,"minLength":1,"type":"string"},"minItems":1,"type":"array","uniqueItems":true}},"required":["required_public_types","required_public_methods","forbidden_public_surfaces","one_webview_collection_type"],"type":"object"},"authority":{"$ref":"#/$defs/authority"},"claim_level":{"const":"MINIMAL_HEPTA_OWNED_EMBEDDER_TOPOLOGY_ONLY"},"decision":{"additionalProperties":false,"properties":{"conditionally_permitted_servo_features":{"const":["js_jit"]},"embedder_strategy":{"const":"out_of_tree_hepta_worker_using_public_servo_embedding_api"},"forbidden_servo_features":{"const":["bluetooth","clipboard","default","default_web_features","default_without_allocator","gamepad","media-gstreamer","native-bluetooth","testbinding","webgl","webgpu","webxr"]},"patch_required_before_servoshell_build":{"const":true},"reason_codes":{"items":{"pattern":"^[A-Z0-9_]{1,256}$","type":"string"},"maxItems":32,"minItems":5,"type":"array","uniqueItems":true},"required_servo_features":{"const":["background_hang_monitor","bundled"]},"servo_crate_path":{"const":"components/servo"},"servo_default_features":{"const":false},"servoshell_build_root":{"const":false},"servoshell_dependency":{"const":false},"webdriver_server_dependency":{"const":false},"worker_owner":{"const":"hepta"}},"required":["embedder_strategy","worker_owner","servo_crate_path","servoshell_build_root","servoshell_dependency","webdriver_server_dependency","servo_default_features","required_servo_features","conditionally_permitted_servo_features","forbidden_servo_features","patch_required_before_servoshell_build","reason_codes"],"type":"object"},"open_gates":{"items":{"maxLength":1024,"minLength":1,"type":"string"},"maxItems":64,"minItems":1,"type":"array","uniqueItems":true},"phase":{"const":"DEVELOPMENT"},"reference_only_files":{"items":{"$ref":"#/$defs/file_entry"},"maxItems":5,"minItems":5,"type":"array"},"runtime_contract":{"additionalProperties":false,"properties":{"arbitrary_javascript":{"const":false},"cookie_storage_profile_export":{"const":false},"download_upload":{"const":false},"external_network":{"const":false},"local_fixture_only":{"const":true},"network_listener":{"const":false},"one_mutation_owner":{"const":true},"one_process":{"const":true},"one_webview":{"const":true},"raw_webdriver":{"const":false},"second_window_or_webview":{"const":false}},"required":["one_process","one_webview","one_mutation_owner","local_fixture_only","external_network","network_listener","raw_webdriver","arbitrary_javascript","cookie_storage_profile_export","download_upload","second_window_or_webview"],"type":"object"},"schema":{"const":"hepta.servo.worker_source_topology.v1"},"schema_version":{"const":1},"selected_files":{"items":{"$ref":"#/$defs/file_entry"},"maxItems":4,"minItems":4,"type":"array"},"source":{"additionalProperties":false,"properties":{"commit":{"const":"0a48e298482659817eb50097df23841f2b8e3044"},"license":{"const":"MPL-2.0"},"repository":{"const":"servo/servo"},"tree":{"const":"b04d2f75b3217374d079d579c270177b57fa1389"}},"required":["repository","commit","tree","license"],"type":"object"},"topology_id":{"pattern":"^hepta-servo-worker-source-topology:v1:[0-9a-f]{64}$","type":"string"}},"required":["schema","schema_version","phase","claim_level","source","decision","selected_files","reference_only_files","api_contract","runtime_contract","open_gates","authority","topology_id"],"title":"Hepta minimal Servo worker source/API topology","type":"object"}