{"api_contract":{"forbidden_public_surfaces":["arbitrary JavaScript evaluation","cookie export","multiple WebViews","preference mutation","profile export","raw WebDriver command passthrough","storage export"],"one_webview_collection_type":"Option<WebView>","required_public_methods":["RenderingContext::present","Servo::spin_event_loop","WebView::load","WebView::notify_input_event","WebView::paint","WebViewBuilder::build","WebViewBuilder::delegate","WebViewBuilder::new"],"required_public_types":["EventLoopWaker","RenderingContext","Servo","ServoBuilder","WebView","WebViewBuilder","WebViewDelegate","WindowRenderingContext"]},"authority":{"credential_export_allowed":false,"effect_authority":false,"execute_allowed":false,"external_effect":false,"external_network_allowed":false,"g5_allowed":false,"machine_authority":false,"operator_acceptance":false,"production_caller":false,"production_writer":false,"promotion":false,"release_qualified":false,"runtime_authority":false},"claim_level":"MINIMAL_HEPTA_OWNED_EMBEDDER_TOPOLOGY_ONLY","decision":{"conditionally_permitted_servo_features":["js_jit"],"embedder_strategy":"out_of_tree_hepta_worker_using_public_servo_embedding_api","forbidden_servo_features":["bluetooth","clipboard","default","default_web_features","default_without_allocator","gamepad","media-gstreamer","native-bluetooth","testbinding","webgl","webgpu","webxr"],"patch_required_before_servoshell_build":true,"reason_codes":["SERVOSHELL_MULTI_WEBVIEW_WINDOW_MODEL_REJECTED","SERVOSHELL_UNCONDITIONAL_BLUETOOTH_REJECTED","SERVOSHELL_UNCONDITIONAL_TESTBINDING_REJECTED","SERVOSHELL_UNCONDITIONAL_WEBDRIVER_SERVER_REJECTED","WEBDRIVER_WILDCARD_HTTP_LISTENER_REJECTED"],"required_servo_features":["background_hang_monitor","bundled"],"servo_crate_path":"components/servo","servo_default_features":false,"servoshell_build_root":false,"servoshell_dependency":false,"webdriver_server_dependency":false,"worker_owner":"hepta"},"open_gates":["Hepta worker crate and Cargo.lock","accepted two-fetch Servo source bundle","artifact-bound private launch","exact Linux toolchain receipt","independent reproducibility comparison","one local-fixture WebView smoke","real build-input manifest and preflight receipt","real worker artifact, symbols and SPDX-2.3 SBOM","reviewed local-fixture-only build recipe","sandbox, listener, egress and descendant-cleanup evidence"],"phase":"DEVELOPMENT","reference_only_files":[{"git_blob_sha1":"8341df151f04a214694dcf0d9ad675e7d1e7fe98","max_bytes":2000000,"path":"components/webdriver_server/lib.rs","required_anchors":["\"/session/{sessionId}/servo/prefs/set\"","SocketAddrV4::new(\"0.0.0.0\".parse().unwrap(), port);","name(\"WebDriverHttpServer\".to_owned())","pub fn start_server(","use std::net::{SocketAddr, SocketAddrV4};"],"role":"rejected HTTP/WebDriver server implementation and wildcard-listener evidence"},{"git_blob_sha1":"2576ee3e26f0772c7737c42215ac266346b1c2ea","max_bytes":256000,"path":"ports/servoshell/Cargo.toml","required_anchors":["default_without_allocator = [\"bundled\", \"default_web_features\", \"max_log_level\", \"js_jit\"]","name = \"servoshell\"","servo = { workspace = true, features = [\"background_hang_monitor\", \"bluetooth\", \"testbinding\"], default-features = false }","webdriver_server = { workspace = true }"],"role":"rejected direct build root because sensitive features and WebDriver are unconditional"},{"git_blob_sha1":"399e0c4fcc68a5c426ff981286ded466fcf9a03b","max_bytes":256000,"path":"ports/servoshell/lib.rs","required_anchors":["desktop::cli::main()","mod webdriver;","pub fn main() {","pub(crate) mod desktop;"],"role":"servoshell headed event-loop reference only; not linked into the Hepta worker"},{"git_blob_sha1":"4685ebd21fd93c20669f947b62a48daf7ae415a5","max_bytes":512000,"path":"ports/servoshell/running_app_state.rs","required_anchors":["pub(crate) webdriver_receiver: Option<Receiver<WebDriverCommandMsg>>","use crate::webdriver::WebDriverEmbedderControls;","webdriver_server::start_server(","windows: RefCell<HashMap<ServoShellWindowId, Rc<ServoShellWindow>>>"],"role":"rejected multi-window/WebDriver runtime root and server-start evidence"},{"git_blob_sha1":"4665c52134a968ab3ff572ac97dab61463967de4","max_bytes":512000,"path":"ports/servoshell/webdriver.rs","required_anchors":["WebDriverCommandMsg::NewWindow","WebDriverCommandMsg::ResetAllCookies","WebDriverCommandMsg::ScriptCommand","pub(crate) fn handle_webdriver_messages("],"role":"WebDriver command routing reference only; raw command path excluded"}],"runtime_contract":{"arbitrary_javascript":false,"cookie_storage_profile_export":false,"download_upload":false,"external_network":false,"local_fixture_only":true,"network_listener":false,"one_mutation_owner":true,"one_process":true,"one_webview":true,"raw_webdriver":false,"second_window_or_webview":false},"schema":"hepta.servo.worker_source_topology.v1","schema_version":1,"selected_files":[{"git_blob_sha1":"de3665c8cf98337aa908ddacef906b4bea7832e5","max_bytes":2000000,"path":"Cargo.toml","required_anchors":["[workspace.package]","[workspace]","default-members = [\"ports/servoshell\"]","edition = \"2024\"","license = \"MPL-2.0\"","rust-version = \"1.88.0\""],"role":"pinned Servo workspace metadata and toolchain/license root"},{"git_blob_sha1":"d9dce354a8db17b95f2ef618d73a19b1438f08fc","max_bytes":256000,"path":"components/servo/Cargo.toml","required_anchors":["background_hang_monitor = [\"servo-background-hang-monitor/sampler\"]","bundled = [\"baked-in-resources\", \"bundled_freetype\"]","default = [\"bundled\", \"clipboard\", \"js_jit\"]","name = \"servo\"","path = \"lib.rs\"","testbinding = [\"script/testbinding\"]","webgpu = [","webxr = ["],"role":"selected Servo engine crate feature and dependency boundary"},{"git_blob_sha1":"9a185c102ca812477c855089fde0af92c937d838","max_bytes":256000,"path":"components/servo/examples/winit_minimal.rs","required_anchors":[".delegate(app_state.clone())","ServoBuilder::default()","WebViewBuilder::new(","state.rendering_context.present();","state.servo.spin_event_loop();","webview.notify_input_event("],"role":"API reference only for a Hepta-owned single-WebView event loop"},{"git_blob_sha1":"f7a33d88ca3fdb68e0984cff95101c4df98df1da","max_bytes":256000,"path":"components/servo/lib.rs","required_anchors":["OffscreenRenderingContext, RenderingContext, SoftwareRenderingContext, WindowRenderingContext,","[`RenderingContext::present`]","[`Servo::spin_event_loop`]","[`WebView::paint`]","pub use crate::servo::{Servo, ServoBuilder, run_content_process};","pub use crate::webview::{WebView, WebViewBuilder};","pub use crate::webview_delegate::{"],"role":"selected public Servo embedding API contract"}],"source":{"commit":"0a48e298482659817eb50097df23841f2b8e3044","license":"MPL-2.0","repository":"servo/servo","tree":"b04d2f75b3217374d079d579c270177b57fa1389"},"topology_id":"hepta-servo-worker-source-topology:v1:4bf29866c8e7509c5adf5307a2cd772e5af708a595439e5f36d3ea053e2fccd0"}